{
  "id": "a1b2c3d4-e5f6-7890-abcd-ef1234567890",
  "title": "Login Credentials",
  "vault": "example-value",
  "category": "DRIVER_LICENSE",
  "urls": [
    "https://example.com"
  ],
  "favorite": true,
  "tags": [
    "example-value"
  ],
  "version": 19,
  "state": "DELETED",
  "createdAt": "2025-03-15T14:30:00Z",
  "updatedAt": "2025-03-15T14:30:00Z",
  "lastEditedBy": "a1b2c3d4-e5f6-7890-abcd-ef1234567890"
}